{"artifact_role":"runtime_artifact","attempt":1,"checks":[{"check_id":"IV1","kind":"raw_intent_reference","status":"pass"},{"check_id":"IV2","kind":"identifier_uniqueness","status":"pass"},{"check_id":"IV3","kind":"source_span_integrity","status":"pass"},{"check_id":"IV4","kind":"controlled_value_integrity","status":"pass"},{"check_id":"IV5","kind":"derived_reference_integrity","status":"pass"},{"check_id":"IV6","kind":"constraint_expression_integrity","status":"pass"},{"check_id":"IV7","kind":"unknown_resolution_integrity","status":"pass"}],"errors":[],"failure_policy":"Return repairable defects for one bounded model repair; never repair user ambiguity.","intent_ir_ref":{"generation":0,"intent_ir_id":"intent-ir-19-experiment-time-series-forecasting-retry-01","sha256":"47f2e6764aecef589e9e29b408c75ba354eebe11d61b486004af7d0f85b0f436"},"limitations":["Structural validation does not prove that normalized statements preserve the user's meaning."],"repair_count":0,"schema_version":"solar.intent_validation.v1","status":"pass","validation_id":"intent-validation-19-experiment-time-series-forecasting-retry-01-g0","warnings":[]}
